Okanogan County Central Landfill - Okanogan,2017,Waste,Landfills,562212,Solid Waste Landfill,Okanogan County,Okanogan,Okanogan,Ecology: Central Regional Office,13567,0,0,13567,0,0,0,0,0,First year reporting.,1,"(48.341148, -119.620109)",POINT (-119.62010900000001 48.341148)
"Vaagen Bros. Lumber, Inc. - Colville",2014,Wood Products,Lumber Mills,321113,Sawmills,Vaagen Bros. Lumber Inc.,Colville,Stevens,Ecology: Eastern Regional Office,49542,48889,1,94,559,0,0,0,0,,2,"(48.548525, -117.915469)",POINT (-117.91546900000002 48.548525)
"Rainier Veneer, Inc. - Spanaway",2013,Wood Products,Other Wood Products,321212,Softwood Veneer and Plywood Manufacturing,Rainier Veneer Inc.,Spanaway,Pierce,Puget Sound Clean Air Agency,19279,18088,949,35,207,0,0,0,0,,1,"(47.062059, -122.318981)",POINT (-122.318981 47.062059)
"Horse Heaven Cattle Feeders, Inc. - Sunnyside",2016,Livestock,Cattle Feedlots,112112,Cattle Feedlots,"Horse Heaven Cattle Feeders, Inc.",Sunnyside,Yakima,Yakima Regional Clean Air Agency,10949,0,0,845,10104,0,0,0,0,,1,"(46.284622, -120.019668)",POINT (-120.019668 46.284622000000006)
"RPMG, Inc.",2012,Transportation Fuel Supplier,Transportation Fuel Supplier,424700,Petroleum and Petroleum Products Merchant Wholesalers,"Renewable Products Marketing Group, LLC",NA,NA,NA,452188,452188,0,0,0,0,0,0,0,,,,
Valero Marketing and Supply Company,2017,Transportation Fuel Supplier,Transportation Fuel Supplier,424720,Petroleum and Petroleum Products Merchant Wholesalers (except Bulk Stations and Terminals),The Premcor Refining Group,NA,NA,NA,27291,1797,25494,0,0,0,0,0,0,,,,
Puget Sound Energy - Ferndale Generating Station - Ferndale,2014,Power Plants,Natural Gas Turbine Plants,221112,Fossil Fuel Electric Power Generation,Puget Holdings LLC,Ferndale,Whatcom,Northwest Clean Air Agency,333194,0,332855,155,184,0,0,0,0,,3,"(48.828707, -122.685533)",POINT (-122.68553299999999 48.82870700000001)
Northwest Pipeline Roosevelt C/S - Bickleton,2013,Natural Gas Systems,Natural Gas Transmission/Compression,486210,Pipeline Transportation of Natural Gas,"The Williams Companies, Inc.",Bickleton,Klickitat,Ecology: Central Regional Office,28675,0,25056,3605,14,0,0,0,0,,2,"(45.849504, -120.08083)",POINT (-120.08083 45.849504)
"Associated Petroleum Products, Inc.",2013,Transportation Fuel Supplier,Transportation Fuel Supplier,424710,Petroleum Bulk Stations and Terminals,"Associated Petroleum Products, Inc.",NA,NA,NA,1054993,36292,1018701,0,0,0,0,0,0,,,,
Lamb Weston - Quincy,2017,Food Production,Potato Products,311411,"Frozen Fruit, Juice, and Vegetable Manufacturing","Lamb Weston, Inc.",Quincy,Grant,Ecology: Eastern Regional Office,34928,0,34892,17,20,0,0,0,0,,2,"(47.234413, -119.869914)",POINT (-119.869914 47.234413)
Cowlitz County Landfill - Longview,2014,Waste,Landfills,562212,Solid Waste Landfill,Cowlitz County,Longview,Cowlitz,Southwest Clean Air Agency,10826,0,0,10826,0,0,0,0,0,,1,"(46.107229, -122.905601)",POINT (-122.905601 46.107229)
Puget Sound Energy LDC - statewide,2013,Natural Gas Systems,Natural Gas Local Distribution Companies,221210,Natural Gas Distribution,Puget Holdings LLC,Bellevue,King,Puget Sound Clean Air Agency,61069,0,74,60996,0,0,0,0,0,,2,,
Agrium Kennewick Fertilizer Operations (KFO) - Kennewick,2015,Chemicals,Fertilizer Production,325311,Nitrogenous Fertilizer Manufacturing,Agrium US Inc.,Kennewick,Benton,Benton Clean Air Agency,155888,0,10731,1,145157,0,0,0,0,,3,"(46.165957, -119.017218)",POINT (-119.017218 46.165957000000006)
Central Washington University - Ellensburg,2015,Government,Education,611310,"Colleges, Universities, and Professional Schools",State of Washington,Ellensburg,Kittitas,Ecology: Central Regional Office,12838,0,12822,7,9,0,0,0,0,,1,"(47.003202, -120.544513)",POINT (-120.544513 47.003202)
Sierra Pacific Industries - Burlington - Mount Vernon,2017,Wood Products,Lumber Mills,321113,Sawmills,Sierra Pacific Industries,Mount Vernon,Skagit,Northwest Clean Air Agency,290046,282314,3958,544,3231,0,0,0,0,,3,"(48.448553, -122.434613)",POINT (-122.43461299999998 48.448553)
Georgia-Pacific Gypsum LLC - Tacoma,2016,Manufacturing,Building Products,327420,Gypsum Product Manufacturing,Koch Industries Inc.,Tacoma,Pierce,Puget Sound Clean Air Agency,48825,0,48775,23,27,0,0,0,0,,2,"(47.269558, -122.394869)",POINT (-122.39486900000001 47.269558)
Port Townsend Paper Corporation - Port Townsend,2016,Pulp and Paper,Kraft Mills,322121,Paper (except Newsprint) Mills,Crown Paper Group Inc.,Port Townsend,Jefferson,Ecology: Industrial Section,489961,422794,64014,550,2603,0,0,0,0,,3,"(48.093793, -122.796806)",POINT (-122.79680600000002 48.093793)
Seattle-Tacoma International Airport - Seattle,2015,Government,Other Government,488119,Other Airport Operations,Port of Seattle,Seattle,King,Puget Sound Clean Air Agency,13660,0,13645,7,8,0,0,0,0,,1,"(47.443643, -122.302452)",POINT (-122.302452 47.443643)
Air Liquide Hydrogen Plant  - Anacortes,2014,Petroleum Systems,Other Petroleum Systems,325120,Industrial Gas Manufacturing,Air Liquide USA Inc.,Anacortes,Skagit,Northwest Clean Air Agency,64110,0,64110,0,0,0,0,0,0,,2,"(48.465617, -122.556032)",POINT (-122.55603199999999 48.465617)
Phillips 66 Company,2018,Transportation Fuel Supplier,Transportation Fuel Supplier,424710,Petroleum Bulk Stations and Terminals,Phillips 66 Company,NA,NA,NA,3532945,201931,3331014,0,0,0,0,0,0,,,,
The Boeing Company - Renton,2015,Manufacturing,Transportation Industry,336411,Aircraft Manufacturing,The Boeing Company,Renton,King,Puget Sound Clean Air Agency,17191,0,17174,8,10,0,0,0,0,,1,"(47.498257, -122.211346)",POINT (-122.211346 47.498257)
Hampton Lumber Mills Washington Inc. - Darrington,2012,Wood Products,Lumber Mills,321113,Sawmills,Hampton Lumber Mills Washington Inc.,Darrington,Snohomish,Puget Sound Clean Air Agency,81603,79856,0,681,1066,0,0,0,0,,2,"(48.262797, -121.597608)",POINT (-121.597608 48.262797)
U.S. Oil & Refining Co. - Tacoma,2019,Petroleum Systems,Petroleum Refineries,324110,Petroleum Refineries,Par Pacific Holdings Inc.,Tacoma,Pierce,Puget Sound Clean Air Agency,155836,0,154515,808,513,0,0,0,0,,3,"(47.256813, -122.394952)",POINT (-122.394952 47.256813)
"Interfor US, Inc. - Port Angeles",2013,Wood Products,Lumber Mills,321113,Sawmills,Interfor US Inc.,Port Angeles,Clallam,Olympic Region Clean Air Agency,41397,40851,0,79,467,0,0,0,0,,2,"(48.103425, -123.518642)",POINT (-123.518642 48.103425)
"Associated Petroleum Products, Inc.",2012,Transportation Fuel Supplier,Transportation Fuel Supplier,424710,Petroleum Bulk Stations and Terminals,"Associated Petroleum Products, Inc.",NA,NA,NA,1003689,0,1003689,0,0,0,0,0,0,,,,
Puget Sound Energy - Frederickson Generating Station - Tacoma,2018,Power Plants,Natural Gas Turbine Plants,221112,Fossil Fuel Electric Power Generation,Puget Holdings LLC,Tacoma,Pierce,Puget Sound Clean Air Agency,41004,0,40961,19,23,0,0,0,0,,2,"(47.079716, -122.364711)",POINT (-122.364711 47.079716)
Gas Transmission Northwest Compressor Station 8 - Wallula,2014,Natural Gas Systems,Natural Gas Transmission/Compression,486210,Pipeline Transportation of Natural Gas,TransCanada Northern Border Inc.,Wallula,Walla Walla,Ecology: Eastern Regional Office,81465,0,75234,6189,42,0,0,0,0,,2,"(46.053153, -118.843934)",POINT (-118.84393399999999 46.053153)
Starbucks Kent Flexible Plant - Kent,2016,Food Production,Other Food Products,311920,Coffee and Tea Manufacturing,Starbucks Corp.,Kent,King,Puget Sound Clean Air Agency,14382,0,14367,7,8,0,0,0,0,,1,"(47.436276, -122.237648)",POINT (-122.237648 47.436276)
Tesoro Refining & Marketing Company LLC,2017,Transportation Fuel Supplier,Transportation Fuel Supplier,324110,Petroleum Refineries,Marathon Petroleum Corp,NA,NA,NA,5081912,273012,4808900,0,0,0,0,0,0,,,,
CenTrio Energy Seattle LLC - Seattle,2012,Power Plants,"Other Power, Heating, or Cooling Plants",221330,Steam and Air-Conditioning Supply,"BIF II District Energy Holdings III, Delaware",Seattle,King,Puget Sound Clean Air Agency,88838,12338,76152,141,207,0,0,0,0,,2,"(47.6068, -122.340179)",POINT (-122.34017900000002 47.6068)
Agrium Kennewick Fertilizer Operations (KFO) - Kennewick,2016,Chemicals,Fertilizer Production,325311,Nitrogenous Fertilizer Manufacturing,Agrium US Inc.,Kennewick,Benton,Benton Clean Air Agency,151371,0,9491,1,141879,0,0,0,0,,3,"(46.165957, -119.017218)",POINT (-119.017218 46.165957000000006)
Roosevelt Regional Landfill - Roosevelt,2018,Waste,Landfills,562212,Solid Waste Landfill,"Republic Services, Inc.",Roosevelt,Klickitat,Ecology: Central Regional Office,247524,0,214,247310,1,0,0,0,0,,3,"(45.807146, -120.179785)",POINT (-120.179785 45.807146)
Guy Bennett Lumber Company - Clarkston,2017,Wood Products,Lumber Mills,321113,Sawmills,Bennett Lumber Products Inc.,Clarkston,Whitman,Ecology: Eastern Regional Office,20024,19760,0,38,226,0,0,0,0,,1,"(46.423108, -117.086487)",POINT (-117.08648699999999 46.423108)
Lamb Weston - Warden,2013,Food Production,Potato Products,311411,"Frozen Fruit, Juice, and Vegetable Manufacturing",Ochoa AG Unlimited Foods Inc.,Warden,Grant,Ecology: Eastern Regional Office,18227,0,18208,9,10,0,0,0,0,,1,"(46.971504, -119.055427)",POINT (-119.05542700000001 46.971504)
Shell Puget Sound Refinery - Anacortes,2018,Petroleum Systems,Petroleum Refineries,324110,Petroleum Refineries,Shell Petroleum Inc.,Anacortes,Skagit,Northwest Clean Air Agency,1989024,0,1977802,6835,4387,0,0,0,0,,4,"(48.470931, -122.559161)",POINT (-122.559161 48.470931)
City of Spokane Northside Landfill - Spokane,2013,Waste,Landfills,562212,Solid Waste Landfill,City of Spokane,Spokane,Spokane,Spokane Regional Clean Air Agency,9883,0,0,9883,0,0,0,0,0,Last year reporting.  Voluntary reporter.,1,"(47.727246, -117.487442)",POINT (-117.487442 47.727246)
U.S. Oil & Refining Co. - Tacoma,2013,Petroleum Systems,Petroleum Refineries,324110,Petroleum Refineries,Par Pacific Holdings Inc.,Tacoma,Pierce,Puget Sound Clean Air Agency,175417,0,172635,2226,555,0,0,0,0,,3,"(47.256813, -122.394952)",POINT (-122.394952 47.256813)
Hampton Lumber Mills Washington Inc. - Morton,2015,Wood Products,Lumber Mills,321113,Sawmills,Hampton Lumber Mills Washington Inc.,Morton,Lewis,Southwest Clean Air Agency,31789,31370,0,60,359,0,0,0,0,,2,"(46.565997, -122.269573)",POINT (-122.269573 46.565997)
"Boise Cascade Wood Products, LLC.  Kettle Falls Plywood - Kettle Falls",2019,Wood Products,Other Wood Products,321212,Softwood Veneer and Plywood Manufacturing,Boise Cascade Company,Kettle Falls,Stevens,Ecology: Eastern Regional Office,73603,56367,16466,116,654,0,0,0,0,,2,"(48.613175, -118.116106)",POINT (-118.116106 48.613175)
Western Petroleum Company,2018,Transportation Fuel Supplier,Transportation Fuel Supplier,424720,Petroleum and Petroleum Products Merchant Wholesalers (except Bulk Stations and Terminals),"World Fuel Services, Corp",NA,NA,NA,5625,22,5603,0,0,0,0,0,0,,,,
DH Feeders - Eltopia,2020,Livestock,Cattle Feedlots,112112,Cattle Feedlots,Easterday Ranches,Eltopia,Franklin,Ecology: Eastern Regional Office,14315,0,1259,1012,12043,0,0,0,0,,1,"(46.50919, -118.881203)",POINT (-118.88120300000001 46.50919)
Emerald City Renewables LLC LFGTE- Graham,2020,Power Plants,"Other Power, Heating, or Cooling Plants",221117,Biomass Electric Power Generation,NECCIF Investments II Inc.,Graham,Pierce,Puget Sound Clean Air Agency,18098,18006,0,28,65,0,0,0,0,,1,"(46.975533, -122.290871)",POINT (-122.29087100000001 46.975533)
Grant County Landfill 1 - Ephrata,2012,Waste,Landfills,562212,Solid Waste Landfill,Grant County,Ephrata,Grant,Ecology: Eastern Regional Office,36858,0,0,36858,0,0,0,0,0,,2,"(47.270759, -119.573764)",POINT (-119.573764 47.270759)
Washington State University - Pullman,2020,Government,Education,611310,"Colleges, Universities, and Professional Schools",State of Washington,Pullman,Whitman,Ecology: Eastern Regional Office,59429,0,59368,28,34,0,0,0,0,,2,"(46.728702, -117.151481)",POINT (-117.15148099999999 46.728702)
Puget Sound Energy LDC - statewide,2019,Natural Gas Systems,Natural Gas Local Distribution Companies,221210,Natural Gas Distribution,Puget Holdings LLC,Bellevue,King,Puget Sound Clean Air Agency,61438,0,105,61333,0,0,0,0,0,,2,,
Vitol Inc.,2016,Transportation Fuel Supplier,Transportation Fuel Supplier,424720,Petroleum and Petroleum Products Merchant Wholesalers (except Bulk Stations and Terminals),Vitol Inc,NA,NA,NA,1551,104,1447,0,0,0,0,0,0,,,,
Grant County Landfill 1 - Ephrata,2020,Waste,Landfills,562212,Solid Waste Landfill,Grant County,Ephrata,Grant,Ecology: Eastern Regional Office,51556,0,0,51556,0,0,0,0,0,,2,"(47.270759, -119.573764)",POINT (-119.573764 47.270759)
Northwest Pipeline C/S - Mount Vernon,2015,Natural Gas Systems,Natural Gas Transmission/Compression,486210,Pipeline Transportation of Natural Gas,"The Williams Companies, Inc.",Mount Vernon,Skagit,Northwest Clean Air Agency,65776,0,63063,2678,35,0,0,0,0,,2,"(48.421967, -122.21547)",POINT (-122.21547000000001 48.421967)
Avista Corporation - WA State DOE Reporting - statewide,2019,Natural Gas Systems,Natural Gas Local Distribution Companies,221121,Electric Bulk Power Transmission and Control,Avista Corp.,Spokane,Spokane,Spokane Regional Clean Air Agency,21356,0,19,15874,0,0,0,5463,0,,1,,
"Solvay Chemicals, Inc. - Longview",2016,Chemicals,Other Chemicals,325188,All Other Basic Inorganic Chemical Manufacturing,Solvay Chemicals Inc.,Longview,Cowlitz,Southwest Clean Air Agency,41712,0,41712,0,0,0,0,0,0,,2,"(46.137218, -122.982847)",POINT (-122.98284700000002 46.137218)
Sierra Pacific Industries - Shelton,2019,Wood Products,Lumber Mills,321113,Sawmills,Sierra Pacific Industries,Shelton,Mason,Olympic Region Clean Air Agency,84086,82977,0,159,949,0,0,0,0,,2,"(47.213448, -123.096517)",POINT (-123.09651699999999 47.213448)
King County Solid Waste Cedar Hills Landfill - Maple Valley,2020,Waste,Landfills,562212,Solid Waste Landfill,King County Solid Waste Division,Maple Valley,King,Puget Sound Clean Air Agency,131246,0,187,131058,1,0,0,0,0,,3,"(47.462625, -122.046025)",POINT (-122.046025 47.462625)
Marathon Anacortes Refinery - Anacortes,2012,Petroleum Systems,Petroleum Refineries,324110,Petroleum Refineries,Marathon Petroleum Corp,Anacortes,Skagit,Northwest Clean Air Agency,1311629,0,1299070,8035,4525,0,0,0,0,,4,"(48.493816, -122.564845)",POINT (-122.564845 48.493816)
Green Plains Trade Group LLC,2014,Transportation Fuel Supplier,Transportation Fuel Supplier,425120,Wholesale Trade Agents and Brokers,Green Plains Inc,NA,NA,NA,171377,171377,0,0,0,0,0,0,0,,,,
Puget Sound Energy LDC - statewide,2017,Natural Gas Systems,Natural Gas Local Distribution Companies,221210,Natural Gas Distribution,Puget Holdings LLC,Bellevue,King,Puget Sound Clean Air Agency,60615,0,103,60512,0,0,0,0,0,,2,,
Cowlitz County Landfill - Longview,2019,Waste,Landfills,562212,Solid Waste Landfill,Cowlitz County,Longview,Cowlitz,Southwest Clean Air Agency,18596,0,0,18596,0,0,0,0,0,,1,"(46.107229, -122.905601)",POINT (-122.905601 46.107229)
Marathon Anacortes Refinery - Anacortes,2016,Petroleum Systems,Petroleum Refineries,324110,Petroleum Refineries,Marathon Petroleum Corp,Anacortes,Skagit,Northwest Clean Air Agency,1359988,0,1354202,2292,3494,0,0,0,0,,4,"(48.493816, -122.564845)",POINT (-122.564845 48.493816)
"Tyson Fresh Meats, Inc. - Wallula",2019,Food Production,Meat Products,311611,Animal (except Poultry) Slaughtering,"Tyson Foods, Inc",Wallula,Walla Walla,Ecology: Eastern Regional Office,130146,0,24643,105490,14,0,0,0,0,,3,"(46.137521, -118.913051)",POINT (-118.91305099999998 46.137521)
Cardinal FG Company - Winlock,2020,Minerals,Glass Production,327211,Flat Glass Manufacturing,Cardinal Glass Industries Inc.,Winlock,Lewis,Southwest Clean Air Agency,103050,0,102980,32,38,0,0,0,0,,3,"(46.544937, -122.926313)",POINT (-122.926313 46.544937)
The Boeing Company - Renton,2018,Manufacturing,Transportation Industry,336411,Aircraft Manufacturing,The Boeing Company,Renton,King,Puget Sound Clean Air Agency,19764,0,19743,9,11,0,0,0,0,,1,"(47.498257, -122.211346)",POINT (-122.211346 47.498257)
WaferTech LLC - Camas,2012,Manufacturing,Electronics Industry,334413,Semiconductor and Related Device Manufacturing,WaferTech LLC,Camas,Clark,Southwest Clean Air Agency,139460,0,13959,7,6495,4589,73492,17903,23016,,3,"(45.619569, -122.454955)",POINT (-122.454955 45.619569)
Waste Management Greater Wenatchee Regional Landfill - East Wenatchee,2020,Waste,Landfills,562212,Solid Waste Landfill,Waste Management Inc.,East Wenatchee,Douglas,Ecology: Central Regional Office,55421,0,0,55421,0,0,0,0,0,,2,"(47.405083, -120.167444)",POINT (-120.167444 47.405083)
"RPMG, Inc.",2013,Transportation Fuel Supplier,Transportation Fuel Supplier,424700,Petroleum and Petroleum Products Merchant Wholesalers,"Renewable Products Marketing Group, LLC",NA,NA,NA,371271,371271,0,0,0,0,0,0,0,,,,
Lamb Weston - Pasco,2018,Food Production,Potato Products,311411,"Frozen Fruit, Juice, and Vegetable Manufacturing","Lamb Weston, Inc.",Pasco,Franklin,Ecology: Eastern Regional Office,43648,0,43603,21,24,0,0,0,0,,2,"(46.288137, -119.115336)",POINT (-119.115336 46.288137)
Riverside Feeders SFL - Kennewick,2016,Livestock,Cattle Feedlots,112112,Cattle Feedlots,Riverside Feeders,Kennewick,Benton,Benton Clean Air Agency,24933,0,2661,1727,20545,0,0,0,0,,1,"(45.991872, -119.136497)",POINT (-119.136497 45.991872)
The Boeing Company: DC/MFC - Tukwila,2017,Manufacturing,Transportation Industry,336411,Aircraft Manufacturing,The Boeing Company,Tukwila,King,Puget Sound Clean Air Agency,15437,0,15421,7,9,0,0,0,0,,1,"(47.516246, -122.298613)",POINT (-122.29861300000002 47.516246)
Shell Puget Sound Refinery - Anacortes,2017,Petroleum Systems,Petroleum Refineries,324110,Petroleum Refineries,Shell Petroleum Inc.,Anacortes,Skagit,Northwest Clean Air Agency,1896679,0,1886572,6040,4067,0,0,0,0,,4,"(48.470931, -122.559161)",POINT (-122.559161 48.470931)
Naval Base Kitsap - Bremerton,2013,Government,National Security,928110,National Security,US Government,Bremerton,Kitsap,Puget Sound Clean Air Agency,46551,0,46501,23,27,0,0,0,0,,2,"(47.557047, -122.645933)",POINT (-122.645933 47.557047)
Grays Harbor Energy Center - Elma,2015,Power Plants,Natural Gas Turbine Plants,221112,Fossil Fuel Electric Power Generation,Stark Power Generation I Holdings LLC,Elma,Grays Harbor,EFSEC,1170621,0,1169432,542,646,0,0,0,0,,4,"(46.9688, -123.48)",POINT (-123.48 46.9688)
Phillips 66 Ferndale Refinery - Ferndale,2017,Petroleum Systems,Petroleum Refineries,324110,Petroleum Refineries,Phillips 66 Company,Ferndale,Whatcom,Northwest Clean Air Agency,748762,0,745076,1794,1892,0,0,0,0,,3,"(48.830142, -122.692114)",POINT (-122.69211400000002 48.830142)
The Boeing Company - Auburn Site - Auburn,2015,Manufacturing,Transportation Industry,336413,Other Aircraft Parts and Auxiliary Equipment Manufacturing,The Boeing Company,Auburn,King,Puget Sound Clean Air Agency,36058,0,36021,17,20,0,0,0,0,,2,"(47.285551, -122.242298)",POINT (-122.242298 47.285551)
Hampton Lumber Mills Washington Inc. - Darrington,2014,Wood Products,Lumber Mills,321113,Sawmills,Hampton Lumber Mills Washington Inc.,Darrington,Snohomish,Puget Sound Clean Air Agency,93894,92656,0,178,1060,0,0,0,0,,2,"(48.262797, -121.597608)",POINT (-121.597608 48.262797)
Cheyne Landfill - Zillah,2019,Waste,Landfills,562212,Solid Waste Landfill,Yakima County Public Services - Solid Waste Division,Zillah,Yakima,Yakima Regional Clean Air Agency,40508,0,0,40508,0,0,0,0,0,,2,"(46.4785, -120.2688)",POINT (-120.26880000000001 46.478500000000004)
River Road Generating Plant - Vancouver,2018,Power Plants,Natural Gas Turbine Plants,221112,Fossil Fuel Electric Power Generation,Clark Public Utilities,Vancouver,Clark,Southwest Clean Air Agency,474250,0,473768,220,262,0,0,0,0,,3,"(45.64958, -122.724806)",POINT (-122.724806 45.64958)
Northwest Hardwoods Inc. - Mount Vernon,2014,Wood Products,Lumber Mills,321113,Sawmills,Littlejohn & Co. LLC,Mount Vernon,Skagit,Northwest Clean Air Agency,12739,8800,3818,19,103,0,0,0,0,,1,"(48.451642, -122.443028)",POINT (-122.44302800000001 48.451642)
Naval Air Station Whidbey Island - Oak Harbor,2016,Government,National Security,928110,National Security,US Government,Oak Harbor,Island,Northwest Clean Air Agency,13366,0,13352,6,8,0,0,0,0,,1,"(48.345281, -122.669741)",POINT (-122.669741 48.345281)
Frito Lay - Vancouver,2019,Food Production,Other Food Products,311919,Other Snack Food Manufacturing,PepsiCo Inc,Vancouver,Clark,Southwest Clean Air Agency,16282,0,16265,8,9,0,0,0,0,,1,"(45.657037, -122.692)",POINT (-122.692 45.657037)
"Nucor Steel Seattle, Inc, - Seattle",2018,Metals,Iron and Steel Production,331111,Iron and Steel Mills,Nucor Corporation,Seattle,King,Puget Sound Clean Air Agency,146394,0,146344,23,27,0,0,0,0,,3,"(47.569331, -122.367332)",POINT (-122.367332 47.569331)
River Road Generating Plant - Vancouver,2016,Power Plants,Natural Gas Turbine Plants,221112,Fossil Fuel Electric Power Generation,Clark Public Utilities,Vancouver,Clark,Southwest Clean Air Agency,569033,0,568455,264,314,0,0,0,0,,3,"(45.64958, -122.724806)",POINT (-122.724806 45.64958)
CertainTeed Gypsum - Seattle,2020,Manufacturing,Building Products,327420,Gypsum Product Manufacturing,Saint-Gobain Corporation,Seattle,King,Puget Sound Clean Air Agency,49936,0,49885,24,28,0,0,0,0,,2,"(47.548056, -122.336944)",POINT (-122.336944 47.548056)
Ascent Aviation Group Inc,2013,Transportation Fuel Supplier,Transportation Fuel Supplier,424720,Petroleum and Petroleum Products Merchant Wholesalers (except Bulk Stations and Terminals),"World Fuel Services, Corp",NA,NA,NA,15728,0,15728,0,0,0,0,0,0,,,,
Elbow River Marketing USA Ltd.,2020,Transportation Fuel Supplier,Transportation Fuel Supplier,412110,Petroleum and petroleum products merchant wholesalers,Parkland Fuel Corporation,NA,NA,NA,73989,2676,71313,0,0,0,0,0,0,,,,
Goodrich Corporation - Spokane,2020,Manufacturing,Transportation Industry,336413,Other Aircraft Parts and Auxiliary Equipment Manufacturing,Goodrich Corp.,Spokane,Spokane,Spokane Regional Clean Air Agency,26829,0,26796,14,19,0,0,0,0,,2,"(47.583604, -117.568511)",POINT (-117.568511 47.583604)
Matheson - Anacortes,2015,Petroleum Systems,Other Petroleum Systems,325120,Industrial Gas Manufacturing,Linde Gas North America LLC,Anacortes,Skagit,Northwest Clean Air Agency,59516,0,59516,0,0,0,0,0,0,,2,"(48.467646, -122.554343)",POINT (-122.554343 48.467646)
Great Western Malt - Vancouver,2013,Food Production,Other Food Products,311213,Malt Manufacturing,Great Western Malt,Vancouver,Clark,Southwest Clean Air Agency,18365,0,18346,9,10,0,0,0,0,,1,"(45.631069, -122.690043)",POINT (-122.69004299999999 45.631069)
Weyerhaeuser Raymond Lumber - Raymond,2016,Wood Products,Lumber Mills,321113,Sawmills,Weyerhaeuser Co.,Raymond,Pacific,Olympic Region Clean Air Agency,47372,46747,0,90,535,0,0,0,0,,2,"(46.688088, -123.737495)",POINT (-123.73749500000001 46.688088)
CHS Inc.,2013,Transportation Fuel Supplier,Transportation Fuel Supplier,4247,Petroleum and Petroleum Products Merchant Wholesalers,CHS Inc.,NA,NA,NA,613851,9449,604402,0,0,0,0,0,0,,,,
Terrace Heights Landfill - Yakima,2019,Waste,Landfills,562212,Solid Waste Landfill,Yakima County Public Services - Solid Waste Division,Yakima,Yakima,Yakima Regional Clean Air Agency,120182,0,25,120158,0,0,0,0,0,,3,"(46.610031, -120.39408)",POINT (-120.39407999999999 46.610031000000006)
CHS Inc.,2012,Transportation Fuel Supplier,Transportation Fuel Supplier,4247,Petroleum and Petroleum Products Merchant Wholesalers,CHS Inc.,NA,NA,NA,618830,29251,589579,0,0,0,0,0,0,,,,
Elbow River Marketing Canada Ltd.,2020,Transportation Fuel Supplier,Transportation Fuel Supplier,412110,Petroleum and petroleum products merchant wholesalers,Parkland Fuel Corporation,NA,NA,NA,10840,0,10840,0,0,0,0,0,0,,,,
Sierra Pacific Industries - Shelton,2016,Wood Products,Lumber Mills,321113,Sawmills,Sierra Pacific Industries,Shelton,Mason,Olympic Region Clean Air Agency,13355,13172,0,26,157,0,0,0,0,,1,"(47.213448, -123.096517)",POINT (-123.09651699999999 47.213448)
Puget Sound Energy - Goldendale Generating Station - Goldendale,2015,Power Plants,Natural Gas Turbine Plants,221112,Fossil Fuel Electric Power Generation,Puget Holdings LLC,Goldendale,Klickitat,Ecology: Central Regional Office,551705,0,551145,256,305,0,0,0,0,,3,"(45.8114, -120.833)",POINT (-120.833 45.8114)
Horn Rapids Sanitary Landfill - Richland,2015,Waste,Landfills,562212,Solid Waste Landfill,City of Richland,Richland,Benton,Benton Clean Air Agency,26870,0,0,26870,0,0,0,0,0,,2,"(46.346663, -119.348118)",POINT (-119.348118 46.34666300000001)
River Road Generating Plant - Vancouver,2017,Power Plants,Natural Gas Turbine Plants,221112,Fossil Fuel Electric Power Generation,Clark Public Utilities,Vancouver,Clark,Southwest Clean Air Agency,495761,0,495258,230,274,0,0,0,0,,3,"(45.64958, -122.724806)",POINT (-122.724806 45.64958)
"Nucor Steel Seattle, Inc, - Seattle",2016,Metals,Iron and Steel Production,331111,Iron and Steel Mills,Nucor Corporation,Seattle,King,Puget Sound Clean Air Agency,97810,0,97765,21,24,0,0,0,0,,2,"(47.569331, -122.367332)",POINT (-122.367332 47.569331)
Roosevelt Regional Landfill - Roosevelt,2017,Waste,Landfills,562212,Solid Waste Landfill,"Republic Services, Inc.",Roosevelt,Klickitat,Ecology: Central Regional Office,208590,0,387,208202,1,0,0,0,0,,3,"(45.807146, -120.179785)",POINT (-120.179785 45.807146)
The Boeing Company: DC/MFC - Tukwila,2019,Manufacturing,Transportation Industry,336411,Aircraft Manufacturing,The Boeing Company,Tukwila,King,Puget Sound Clean Air Agency,13784,0,13769,7,8,0,0,0,0,,1,"(47.516246, -122.298613)",POINT (-122.29861300000002 47.516246)
Phillips 66 Company,2016,Transportation Fuel Supplier,Transportation Fuel Supplier,424710,Petroleum Bulk Stations and Terminals,Phillips 66 Company,NA,NA,NA,4761013,266360,4494653,0,0,0,0,0,0,,,,
"El Oro Cattle Feeders, LLC - Moses Lake",2014,Livestock,Cattle Feedlots,112112,Cattle Feedlots,Agri Beef Co.,Moses Lake,Grant,Ecology: Eastern Regional Office,22875,0,0,1770,21105,0,0,0,0,,1,"(47.052176, -119.093815)",POINT (-119.09381500000002 47.052176)
