Cosmo Specialty Fibers Inc - Cosmopolis,2014,Pulp and Paper,Sulfite Mills,322110,Pulp Mills,Gores Group,Cosmopolis,Grays Harbor,Ecology: Industrial Section,1185707,1152820,23988,5650,3248,0,0,0,0,,4,"(46.952907, -123.76211)",POINT (-123.76211 46.952907)
"Emerald Kalama Chemical, LLC - Kalama",2015,Chemicals,Other Chemicals,325199,All Other Basic Organic Chemical Manufacturing,Emerald Performance Materials LLC,Kalama,Cowlitz,Southwest Clean Air Agency,87579,0,87494,37,48,0,0,0,0,,2,"(46.02191, -122.85698)",POINT (-122.85697999999998 46.02191)
H.W. Hill Landfill Gas Power Plant - Roosevelt,2018,Power Plants,"Other Power, Heating, or Cooling Plants",221119,Other Electric Power Generation,Public Utility District No. 1 of Klickitat County,Roosevelt,Klickitat,Ecology: Central Regional Office,42846,42400,229,65,153,0,0,0,0,,2,"(45.807765, -120.166354)",POINT (-120.16635399999998 45.807765)
Horn Rapids Sanitary Landfill - Richland,2013,Waste,Landfills,562212,Solid Waste Landfill,City of Richland,Richland,Benton,Benton Clean Air Agency,28387,0,0,28387,0,0,0,0,0,,2,"(46.346663, -119.348118)",POINT (-119.348118 46.34666300000001)
Valero Marketing and Supply Company,2015,Transportation Fuel Supplier,Transportation Fuel Supplier,424720,Petroleum and Petroleum Products Merchant Wholesalers (except Bulk Stations and Terminals),The Premcor Refining Group,NA,NA,NA,110012,6829,103183,0,0,0,0,0,0,,,,
Inland Empire Paper Company - Spokane,2012,Pulp and Paper,Other Pulp and Paper,322122,Newsprint Mills,Cowles Publishing Co.,Spokane,Spokane,Spokane Regional Clean Air Agency,36152,17985,17755,162,250,0,0,0,0,,2,"(47.688295, -117.279323)",POINT (-117.279323 47.688295)
U.S. Department of Energy Hanford Site - Richland,2013,Government,Other Government,924110,Administration of Air and Water Resource and Solid Waste Management Programs,US Government,Richland,Benton,Ecology: NWP,14615,0,4297,10313,5,0,0,0,0,,1,"(46.55069, -119.489007)",POINT (-119.48900700000002 46.55069)
Puget Sound Energy - Whitehorn Generating Station - Blaine,2012,Power Plants,Natural Gas Turbine Plants,221112,Fossil Fuel Electric Power Generation,Puget Holdings LLC,Blaine,Whatcom,Northwest Clean Air Agency,27310,0,27279,14,18,0,0,0,0,,2,"(48.885475, -122.724299)",POINT (-122.724299 48.885475)
City of Tacoma Solid Waste Facility - Tacoma,2016,Waste,Landfills,562212,Solid Waste Landfill,City of Tacoma,Tacoma,Pierce,Puget Sound Clean Air Agency,14513,0,0,14513,0,0,0,0,0,,1,"(47.223413, -122.499775)",POINT (-122.49977500000001 47.22341300000001)
University of Washington Seattle Campus - Seattle,2013,Government,Education,611310,"Colleges, Universities, and Professional Schools",State of Washington,Seattle,King,Puget Sound Clean Air Agency,90339,0,90242,44,54,0,0,0,0,,2,"(47.653614, -122.303608)",POINT (-122.303608 47.653614)
Northwest Hardwoods Inc. - Centralia,2017,Wood Products,Lumber Mills,321113,Sawmills,Littlejohn & Co. LLC,Centralia,Lewis,Southwest Clean Air Agency,10678,7117,3463,16,83,0,0,0,0,,1,"(46.734454, -122.991963)",POINT (-122.99196300000001 46.734454)
The Boeing Company: Boeing Plant 2 - Seattle,2015,Manufacturing,Transportation Industry,336411,Aircraft Manufacturing,The Boeing Company,Seattle,King,Puget Sound Clean Air Agency,21499,0,21477,10,12,0,0,0,0,,1,"(47.532524, -122.311623)",POINT (-122.31162300000001 47.532524)
Darling Ingredients Inc - Tacoma,2020,Food Production,Meat Products,311613,Rendering and Meat Byproduct Processing,Darling Ingredients Inc.,Tacoma,Pierce,Puget Sound Clean Air Agency,9953,0,9943,5,6,0,0,0,0,,1,"(47.250503, -122.406461)",POINT (-122.406461 47.250503)
TAC Energy,2020,Transportation Fuel Supplier,Transportation Fuel Supplier,424720,Petroleum and Petroleum Products Merchant Wholesalers (except Bulk Stations and Terminals),Truman Arnold Companies,NA,NA,NA,222278,9652,212626,0,0,0,0,0,0,,,,
Star Forge LLC dba Jorgensen Forge - Tukwila,2012,Metals,Iron and Steel Production,332111,Iron and Steel Forging,Jorgensen Forge Corp.,Tukwila,King,Puget Sound Clean Air Agency,20917,0,20896,10,11,0,0,0,0,,1,"(47.526872, -122.303906)",POINT (-122.303906 47.526872)
Simplot Feeders LTD. - Burbank,2016,Livestock,Cattle Feedlots,112112,Cattle Feedlots,J.R. Simplot Company,Burbank,Walla Walla,Ecology: Eastern Regional Office,23348,0,0,1630,21717,0,0,0,0,,1,"(46.133131, -118.90629)",POINT (-118.90629 46.133131)
The Boeing Company,2016,Transportation Fuel Supplier,Transportation Fuel Supplier,336411,Aircraft Manufacturing,The Boeing Company,NA,NA,NA,120830,0,120830,0,0,0,0,0,0,,,,
Cowlitz County Landfill - Longview,2018,Waste,Landfills,562212,Solid Waste Landfill,Cowlitz County,Longview,Cowlitz,Southwest Clean Air Agency,20542,0,0,20542,0,0,0,0,0,,1,"(46.107229, -122.905601)",POINT (-122.905601 46.107229)
Cowlitz County Headquarters Landfill - Castle Rock,2012,Waste,Landfills,562212,Solid Waste Landfill,Cowlitz County,Castle Rock,Cowlitz,Southwest Clean Air Agency,121597,659,0,120936,2,0,0,0,0,,3,"(46.246902, -122.772284)",POINT (-122.772284 46.246902)
Northwest Pipeline C/S - Goldendale,2016,Natural Gas Systems,Natural Gas Transmission/Compression,486210,Pipeline Transportation of Natural Gas,"The Williams Companies, Inc.",Goldendale,Klickitat,Ecology: Central Regional Office,20352,0,17293,3049,10,0,0,0,0,,1,"(45.771216, -120.799267)",POINT (-120.799267 45.771216)
King County Solid Waste Cedar Hills Landfill - Maple Valley,2013,Waste,Landfills,562212,Solid Waste Landfill,King County Solid Waste Division,Maple Valley,King,Puget Sound Clean Air Agency,65974,0,220,65753,1,0,0,0,0,Assigned emissions level: reported under obsolete method.,2,"(47.462625, -122.046025)",POINT (-122.046025 47.462625)
"RPMG, Inc.",2016,Transportation Fuel Supplier,Transportation Fuel Supplier,424700,Petroleum and Petroleum Products Merchant Wholesalers,"Renewable Products Marketing Group, LLC",NA,NA,NA,448981,448981,0,0,0,0,0,0,0,,,,
Frederickson Power LP - Tacoma,2016,Power Plants,Natural Gas Turbine Plants,221112,Fossil Fuel Electric Power Generation,Puget Holdings LLC,Tacoma,Pierce,Puget Sound Clean Air Agency,330385,0,330050,153,182,0,0,0,0,,3,"(47.086342, -122.365686)",POINT (-122.36568599999998 47.086342)
Ponderay Newsprint Company - Usk,2014,Pulp and Paper,Other Pulp and Paper,322122,Newsprint Mills,Ponderay Newsprint Company,Usk,Pend Oreille,Ecology: Eastern Regional Office,53646,51117,1774,119,635,0,0,0,0,,2,"(48.289771, -117.271359)",POINT (-117.27135900000002 48.289771)
Washington State University - Pullman,2017,Government,Education,611310,"Colleges, Universities, and Professional Schools",State of Washington,Pullman,Whitman,Ecology: Eastern Regional Office,65446,0,65377,31,38,0,0,0,0,,2,"(46.728702, -117.151481)",POINT (-117.15148099999999 46.728702)
US Army Joint Base Lewis-McChord - Pierce Co.,2013,Government,National Security,928110,National Security,US Government,Joint Base Lewis-McChord,Pierce,Puget Sound Clean Air Agency,83806,0,60203,23560,43,0,0,0,0,,2,"(47.1142, -122.5365)",POINT (-122.53650000000002 47.1142)
Air Liquide Hydrogen Plant  - Anacortes,2019,Petroleum Systems,Other Petroleum Systems,325120,Industrial Gas Manufacturing,Air Liquide USA Inc.,Anacortes,Skagit,Northwest Clean Air Agency,66107,0,66107,0,0,0,0,0,0,,2,"(48.465617, -122.556032)",POINT (-122.55603199999999 48.465617)
Imerys Minerals Quincy Plant - Quincy,2012,Minerals,Other Minerals,212399,All Other Nonmetallic Mineral Mining,Imerys Filtration Minerals Inc.,Quincy,Grant,Ecology: Eastern Regional Office,22288,0,22265,11,13,0,0,0,0,,1,"(47.239948, -119.838831)",POINT (-119.83883100000001 47.239948)
Simplot Feeders LTD. - Burbank,2012,Livestock,Cattle Feedlots,112112,Cattle Feedlots,J.R. Simplot Company,Burbank,Walla Walla,Ecology: Eastern Regional Office,29167,0,0,2102,27065,0,0,0,0,,2,"(46.133131, -118.90629)",POINT (-118.90629 46.133131)
The Boeing Company: Boeing Plant 2 - Seattle,2017,Manufacturing,Transportation Industry,336411,Aircraft Manufacturing,The Boeing Company,Seattle,King,Puget Sound Clean Air Agency,24064,0,24039,11,13,0,0,0,0,,1,"(47.532524, -122.311623)",POINT (-122.31162300000001 47.532524)
"World Fuel Services, Inc.",2018,Transportation Fuel Supplier,Transportation Fuel Supplier,424720,Petroleum and Petroleum Products Merchant Wholesalers (except Bulk Stations and Terminals),"World Fuel Services, Corp",NA,NA,NA,255971,58,255913,0,0,0,0,0,0,,,,
Sonoco Products - Sumner,2014,Pulp and Paper,Other Pulp and Paper,322130,Paperboard Mills,Sonoco Products Company,Sumner,Pierce,Puget Sound Clean Air Agency,10814,0,10803,5,6,0,0,0,0,,1,"(47.210641, -122.239474)",POINT (-122.23947400000002 47.210641)
"SEI Fuel Services, Inc.",2017,Transportation Fuel Supplier,Transportation Fuel Supplier,447110,Gasoline Stations with Convenience Stores,"7-Eleven, Inc.",NA,NA,NA,316171,20344,295827,0,0,0,0,0,0,,,,
NW Natural LDC - WA - statewide,2015,Natural Gas Systems,Natural Gas Local Distribution Companies,221210,Natural Gas Distribution,NW Natural,Portland,Clark,Southwest Clean Air Agency,7824,0,9,7815,0,0,0,0,0,,1,,
Boeing Commercial Airplanes - Everett,2020,Manufacturing,Transportation Industry,336411,Aircraft Manufacturing,The Boeing Company,Everett,Snohomish,Puget Sound Clean Air Agency,67553,0,67483,32,38,0,0,0,0,,2,"(47.918622, -122.276987)",POINT (-122.27698699999999 47.918622)
ExxonMobil Oil Corporation,2019,Transportation Fuel Supplier,Transportation Fuel Supplier,424720,Petroleum and Petroleum Products Merchant Wholesalers (except Bulk Stations and Terminals),ExxonMobil Oil Corporation,NA,NA,NA,930706,49765,880941,0,0,0,0,0,0,,,,
Puget Sound Energy LDC - statewide,2016,Natural Gas Systems,Natural Gas Local Distribution Companies,221210,Natural Gas Distribution,Puget Holdings LLC,Bellevue,King,Puget Sound Clean Air Agency,58711,0,73,58638,0,0,0,0,0,,2,,
Matheson - Anacortes,2020,Petroleum Systems,Other Petroleum Systems,325120,Industrial Gas Manufacturing,Linde Gas North America LLC,Anacortes,Skagit,Northwest Clean Air Agency,47485,0,47485,0,0,0,0,0,0,,2,"(48.467646, -122.554343)",POINT (-122.554343 48.467646)
Ascent Aviation Group Inc,2014,Transportation Fuel Supplier,Transportation Fuel Supplier,424720,Petroleum and Petroleum Products Merchant Wholesalers (except Bulk Stations and Terminals),"World Fuel Services, Corp",NA,NA,NA,44724,0,44724,0,0,0,0,0,0,,,,
CertainTeed Gypsum - Seattle,2019,Manufacturing,Building Products,327420,Gypsum Product Manufacturing,Saint-Gobain Corporation,Seattle,King,Puget Sound Clean Air Agency,49333,0,49282,23,28,0,0,0,0,,2,"(47.548056, -122.336944)",POINT (-122.336944 47.548056)
Boulder Park Generating Station - Spokane Valley,2013,Power Plants,"Other Power, Heating, or Cooling Plants",221112,Fossil Fuel Electric Power Generation,Avista Corp.,Spokane Valley,Spokane,Spokane Regional Clean Air Agency,10795,0,10784,5,6,0,0,0,0,,1,"(47.696999, -117.147223)",POINT (-117.147223 47.696999)
Horn Rapids Sanitary Landfill - Richland,2014,Waste,Landfills,562212,Solid Waste Landfill,City of Richland,Richland,Benton,Benton Clean Air Agency,25582,0,0,25582,0,0,0,0,0,,2,"(46.346663, -119.348118)",POINT (-119.348118 46.34666300000001)
Kettle Falls Generating Station - Kettle Falls,2013,Power Plants,"Other Power, Heating, or Cooling Plants",221119,Other Electric Power Generation,Avista Corp.,Kettle Falls,Stevens,Ecology: Eastern Regional Office,424907,407568,4007,8669,4663,0,0,0,0,,3,"(48.620335, -118.110841)",POINT (-118.110841 48.620335)
Naval Base Kitsap - Bremerton,2018,Government,National Security,928110,National Security,US Government,Bremerton,Kitsap,Puget Sound Clean Air Agency,43240,0,43194,21,25,0,0,0,0,,2,"(47.557047, -122.645933)",POINT (-122.645933 47.557047)
U.S. Oil & Refining Co.,2012,Transportation Fuel Supplier,Transportation Fuel Supplier,32411,Petroleum Refineries,"Astra Energy Holdings, Inc.",NA,NA,NA,1159448,0,1159448,0,0,0,0,0,0,,,,
Northwest Pipeline C/S - Chehalis,2014,Natural Gas Systems,Natural Gas Transmission/Compression,486210,Pipeline Transportation of Natural Gas,"The Williams Companies, Inc.",Chehalis,Lewis,Southwest Clean Air Agency,6521,0,5724,793,3,0,0,0,0,,1,"(46.533325, -122.87373)",POINT (-122.87373000000001 46.533325)
Ardagh Glass Inc. - Seattle,2018,Minerals,Glass Production,327213,Glass Container Manufacturing,Saint-Gobain Corporation,Seattle,King,Puget Sound Clean Air Agency,76476,0,76415,28,33,0,0,0,0,,2,"(47.55242, -122.33739)",POINT (-122.33739000000001 47.552420000000005)
The Boeing Company: DC/MFC - Tukwila,2018,Manufacturing,Transportation Industry,336411,Aircraft Manufacturing,The Boeing Company,Tukwila,King,Puget Sound Clean Air Agency,15468,0,15451,8,9,0,0,0,0,,1,"(47.516246, -122.298613)",POINT (-122.29861300000002 47.516246)
Puget Sound Energy - Sumas Generating Station - Sumas,2017,Power Plants,Natural Gas Turbine Plants,221112,Fossil Fuel Electric Power Generation,Puget Holdings LLC,Sumas,Whatcom,Northwest Clean Air Agency,125472,0,125345,58,69,0,0,0,0,,3,"(48.9905, -122.2733)",POINT (-122.27329999999999 48.9905)
US Army Joint Base Lewis-McChord - Pierce Co.,2012,Government,National Security,928110,National Security,US Government,Joint Base Lewis-McChord,Pierce,Puget Sound Clean Air Agency,86478,0,62395,24037,46,0,0,0,0,,2,"(47.1142, -122.5365)",POINT (-122.53650000000002 47.1142)
Starbucks Kent Flexible Plant - Kent,2017,Food Production,Other Food Products,311920,Coffee and Tea Manufacturing,Starbucks Corp.,Kent,King,Puget Sound Clean Air Agency,14186,0,14172,7,8,0,0,0,0,,1,"(47.436276, -122.237648)",POINT (-122.237648 47.436276)
Goodrich Corporation - Spokane,2012,Manufacturing,Transportation Industry,336413,Other Aircraft Parts and Auxiliary Equipment Manufacturing,Goodrich Corp.,Spokane,Spokane,Spokane Regional Clean Air Agency,35476,0,35426,20,30,0,0,0,0,,2,"(47.583604, -117.568511)",POINT (-117.568511 47.583604)
WaferTech LLC - Camas,2017,Manufacturing,Electronics Industry,334413,Semiconductor and Related Device Manufacturing,WaferTech LLC,Camas,Clark,Southwest Clean Air Agency,112737,0,14080,7,7737,11232,35881,22424,21376,,3,"(45.619569, -122.454955)",POINT (-122.454955 45.619569)
U.S. Oil & Refining Co. - Tacoma,2020,Petroleum Systems,Petroleum Refineries,324110,Petroleum Refineries,Par Pacific Holdings Inc.,Tacoma,Pierce,Puget Sound Clean Air Agency,163311,0,161866,909,536,0,0,0,0,,3,"(47.256813, -122.394952)",POINT (-122.394952 47.256813)
"El Oro Cattle Feeders, LLC - Moses Lake",2017,Livestock,Cattle Feedlots,112112,Cattle Feedlots,Agri Beef Co.,Moses Lake,Grant,Ecology: Eastern Regional Office,26281,0,0,2038,24243,0,0,0,0,,2,"(47.052176, -119.093815)",POINT (-119.09381500000002 47.052176)
Georgia-Pacific Gypsum LLC - Tacoma,2020,Manufacturing,Building Products,327420,Gypsum Product Manufacturing,Koch Industries Inc.,Tacoma,Pierce,Puget Sound Clean Air Agency,38732,0,38692,18,22,0,0,0,0,,2,"(47.269558, -122.394869)",POINT (-122.39486900000001 47.269558)
Puget Sound Energy - Mint Farm Generating Station - Longview,2015,Power Plants,Natural Gas Turbine Plants,221112,Fossil Fuel Electric Power Generation,Puget Holdings LLC,Longview,Cowlitz,Southwest Clean Air Agency,685789,0,685093,318,379,0,0,0,0,,3,"(46.140095, -122.985138)",POINT (-122.98513800000002 46.140095)
Northwest Pipeline C/S - Sumner,2015,Natural Gas Systems,Natural Gas Transmission/Compression,486210,Pipeline Transportation of Natural Gas,"The Williams Companies, Inc.",Sumner,Pierce,Puget Sound Clean Air Agency,50469,0,50142,299,28,0,0,0,0,,2,"(47.228986, -122.209551)",POINT (-122.20955100000002 47.228986)
"Bio Energy Washington, LLC - Maple Valley",2012,Power Plants,"Other Power, Heating, or Cooling Plants",221119,Other Electric Power Generation,Bio Energy Washington,Maple Valley,King,Puget Sound Clean Air Agency,13697,12800,830,20,48,0,0,0,0,,1,"(47.455871, -122.041817)",POINT (-122.041817 47.455871)
Lamb Weston - Pasco,2014,Food Production,Potato Products,311411,"Frozen Fruit, Juice, and Vegetable Manufacturing","Lamb Weston, Inc.",Pasco,Franklin,Ecology: Eastern Regional Office,47241,0,47192,22,27,0,0,0,0,,2,"(46.288137, -119.115336)",POINT (-119.115336 46.288137)
Avfuel Corporation,2013,Transportation Fuel Supplier,Transportation Fuel Supplier,424700,Petroleum and Petroleum Products Merchant Wholesalers,CRS Acquisition,NA,NA,NA,67999,0,67999,0,0,0,0,0,0,,,,
McKinley Paper Co. - Washington Mill - Port Angeles,2015,Pulp and Paper,Other Pulp and Paper,322121,Paper (except Newsprint) Mills,Nippon Paper Industries USA Co Ltd,Port Angeles,Clallam,Olympic Region Clean Air Agency,223631,214771,1633,4767,2460,0,0,0,0,,3,"(48.134623, -123.467524)",POINT (-123.46752400000001 48.134623)
CityServiceValcon LLC,2019,Transportation Fuel Supplier,Transportation Fuel Supplier,424720,Petroleum and Petroleum Products Merchant Wholesalers (except Bulk Stations and Terminals),"CityServiceValcon, LLC",NA,NA,NA,441407,20511,420896,0,0,0,0,0,0,,,,
PacifiCorp Energy - Chehalis Generation Facility - Chehalis,2019,Power Plants,Natural Gas Turbine Plants,221112,Fossil Fuel Electric Power Generation,Berkshire Hathaway,Chehalis,Lewis,EFSEC,979557,0,978562,454,541,0,0,0,0,,3,"(46.6226, -122.9145)",POINT (-122.91449999999999 46.6226)
Alcoa Intalco Works - Ferndale,2017,Metals,Aluminum Production,331312,Primary Aluminum Production,Alcoa Corp.,Ferndale,Whatcom,Ecology: Industrial Section,1092946,0,354712,9675,32,0,728526,0,0,PFC emissions based on old source test information.,4,"(48.8455, -122.7055)",POINT (-122.70549999999999 48.8455)
Naval Base Kitsap - Bremerton,2019,Government,National Security,928110,National Security,US Government,Bremerton,Kitsap,Puget Sound Clean Air Agency,45128,0,45081,22,26,0,0,0,0,,2,"(47.557047, -122.645933)",POINT (-122.645933 47.557047)
Avista Corporation - WA State DOE Reporting - statewide,2016,Natural Gas Systems,Natural Gas Local Distribution Companies,221121,Electric Bulk Power Transmission and Control,Avista Corp.,Spokane,Spokane,Spokane Regional Clean Air Agency,21120,0,19,15452,0,0,0,5650,0,,1,,
Northwest Pipeline C/S - Sumas,2012,Natural Gas Systems,Natural Gas Transmission/Compression,486210,Pipeline Transportation of Natural Gas,"The Williams Companies, Inc.",Sumas,Whatcom,Northwest Clean Air Agency,70801,0,64130,6632,39,0,0,0,0,,2,"(49.001, -122.2214)",POINT (-122.22139999999999 49.001)
Avfuel Corporation,2012,Transportation Fuel Supplier,Transportation Fuel Supplier,424700,Petroleum and Petroleum Products Merchant Wholesalers,CRS Acquisition,NA,NA,NA,41989,0,41989,0,0,0,0,0,0,,,,
Tree Top - Wenatchee,2018,Food Production,Fruit Products,311423,Dried and Dehydrated Food Manufacturing,Tree Top Inc.,Wenatchee,Chelan,Ecology: Central Regional Office,10912,0,10901,5,6,0,0,0,0,,1,"(47.48938, -120.31426)",POINT (-120.31425999999999 47.48938)
Ardagh Glass Inc. - Seattle,2013,Minerals,Glass Production,327213,Glass Container Manufacturing,Saint-Gobain Corporation,Seattle,King,Puget Sound Clean Air Agency,80745,0,80683,29,34,0,0,0,0,,2,"(47.55242, -122.33739)",POINT (-122.33739000000001 47.552420000000005)
Elbow River Marketing USA Ltd.,2018,Transportation Fuel Supplier,Transportation Fuel Supplier,412110,Petroleum and petroleum products merchant wholesalers,Parkland Fuel Corporation,NA,NA,NA,188001,0,188001,0,0,0,0,0,0,,,,
Ponderay Newsprint Company - Usk,2020,Pulp and Paper,Other Pulp and Paper,322122,Newsprint Mills,Ponderay Newsprint Company,Usk,Pend Oreille,Ecology: Eastern Regional Office,27486,24042,3110,50,284,0,0,0,0,,2,"(48.289771, -117.271359)",POINT (-117.27135900000002 48.289771)
Puget Sound Energy - Fredonia Generating Station - Mount Vernon,2013,Power Plants,Natural Gas Turbine Plants,221112,Fossil Fuel Electric Power Generation,Puget Holdings LLC,Mount Vernon,Skagit,Northwest Clean Air Agency,82399,0,82311,40,49,0,0,0,0,,2,"(48.4553, -122.435)",POINT (-122.43499999999999 48.4553)
Horn Rapids Sanitary Landfill - Richland,2018,Waste,Landfills,562212,Solid Waste Landfill,City of Richland,Richland,Benton,Benton Clean Air Agency,24475,0,0,24475,0,0,0,0,0,,1,"(46.346663, -119.348118)",POINT (-119.348118 46.34666300000001)
"Nucor Steel Seattle, Inc, - Seattle",2017,Metals,Iron and Steel Production,331111,Iron and Steel Mills,Nucor Corporation,Seattle,King,Puget Sound Clean Air Agency,168980,0,168933,22,26,0,0,0,0,,3,"(47.569331, -122.367332)",POINT (-122.367332 47.569331)
Ardagh Glass Inc. - Seattle,2014,Minerals,Glass Production,327213,Glass Container Manufacturing,Saint-Gobain Corporation,Seattle,King,Puget Sound Clean Air Agency,78044,0,77984,28,33,0,0,0,0,,2,"(47.55242, -122.33739)",POINT (-122.33739000000001 47.552420000000005)
Naval Air Station Whidbey Island - Oak Harbor,2017,Government,National Security,928110,National Security,US Government,Oak Harbor,Island,Northwest Clean Air Agency,15460,0,15444,7,9,0,0,0,0,,1,"(48.345281, -122.669741)",POINT (-122.669741 48.345281)
Ascent Aviation Group Inc,2015,Transportation Fuel Supplier,Transportation Fuel Supplier,424720,Petroleum and Petroleum Products Merchant Wholesalers (except Bulk Stations and Terminals),"World Fuel Services, Corp",NA,NA,NA,66762,0,66762,0,0,0,0,0,0,,,,
Northwest Pipeline C/S - Sumas,2020,Natural Gas Systems,Natural Gas Transmission/Compression,486210,Pipeline Transportation of Natural Gas,"The Williams Companies, Inc.",Sumas,Whatcom,Northwest Clean Air Agency,74143,0,71497,2607,40,0,0,0,0,,2,"(49.001, -122.2214)",POINT (-122.22139999999999 49.001)
Cascade Natural Gas Corporation LDC - statewide,2017,Natural Gas Systems,Natural Gas Local Distribution Companies,221210,Natural Gas Distribution,MDU Resources Group Inc.,Kennewick,Benton,Benton Clean Air Agency,26227,0,116,26111,0,0,0,0,0,,2,,
H.W. Hill Landfill Gas Power Plant - Roosevelt,2019,Power Plants,"Other Power, Heating, or Cooling Plants",221119,Other Electric Power Generation,Public Utility District No. 1 of Klickitat County,Roosevelt,Klickitat,Ecology: Central Regional Office,1208,0,1207,1,1,0,0,0,0,Facility converted from onsite electricity generation to processing landfill gas for pipeline use.,1,"(45.807765, -120.166354)",POINT (-120.16635399999998 45.807765)
Hampton Lumber Mills Washington Inc. - Morton,2016,Wood Products,Lumber Mills,321113,Sawmills,Hampton Lumber Mills Washington Inc.,Morton,Lewis,Southwest Clean Air Agency,30741,30336,0,58,347,0,0,0,0,,2,"(46.565997, -122.269573)",POINT (-122.269573 46.565997)
Northwest Hardwoods Inc. - Centralia,2013,Wood Products,Lumber Mills,321113,Sawmills,Littlejohn & Co. LLC,Centralia,Lewis,Southwest Clean Air Agency,12987,6470,6424,16,77,0,0,0,0,,1,"(46.734454, -122.991963)",POINT (-122.99196300000001 46.734454)
"Nucor Steel Seattle, Inc, - Seattle",2012,Metals,Iron and Steel Production,331111,Iron and Steel Mills,Nucor Corporation,Seattle,King,Puget Sound Clean Air Agency,124468,0,124425,20,24,0,0,0,0,,3,"(47.569331, -122.367332)",POINT (-122.367332 47.569331)
Hampton Lumber Mills Washington Inc. - Morton,2014,Wood Products,Lumber Mills,321113,Sawmills,Hampton Lumber Mills Washington Inc.,Morton,Lewis,Southwest Clean Air Agency,28827,28447,0,55,325,0,0,0,0,,2,"(46.565997, -122.269573)",POINT (-122.269573 46.565997)
LRI Landfill - Graham,2016,Waste,Landfills,562212,Solid Waste Landfill,Waste Connections Inc.,Graham,Pierce,Puget Sound Clean Air Agency,115122,0,0,115122,0,0,0,0,0,,3,"(46.972405, -122.292799)",POINT (-122.292799 46.972405)
Terrace Heights Landfill - Yakima,2015,Waste,Landfills,562212,Solid Waste Landfill,Yakima County Public Services - Solid Waste Division,Yakima,Yakima,Yakima Regional Clean Air Agency,109385,0,26,109359,0,0,0,0,0,,3,"(46.610031, -120.39408)",POINT (-120.39407999999999 46.610031000000006)
J.R. Simplot Company - Othello,2017,Food Production,Potato Products,311411,"Frozen Fruit, Juice, and Vegetable Manufacturing",J.R. Simplot Company,Othello,Adams,Ecology: Eastern Regional Office,95215,0,49074,46114,27,0,0,0,0,,2,"(46.837778, -119.176389)",POINT (-119.17638900000001 46.837778)
Seattle-Tacoma International Airport - Seattle,2017,Government,Other Government,488119,Other Airport Operations,Port of Seattle,Seattle,King,Puget Sound Clean Air Agency,14791,0,14776,7,8,0,0,0,0,,1,"(47.443643, -122.302452)",POINT (-122.302452 47.443643)
Darling Ingredients Inc - Tacoma,2017,Food Production,Meat Products,311613,Rendering and Meat Byproduct Processing,Darling Ingredients Inc.,Tacoma,Pierce,Puget Sound Clean Air Agency,11327,0,11315,5,6,0,0,0,0,,1,"(47.250503, -122.406461)",POINT (-122.406461 47.250503)
"Coleman Oil Company, LLC",2012,Transportation Fuel Supplier,Transportation Fuel Supplier,424720,Petroleum and Petroleum Products Merchant Wholesalers (except Bulk Stations and Terminals),"Coleman Oil Company, LLC",NA,NA,NA,276433,11733,264700,0,0,0,0,0,0,,,,
Western Petroleum Company,2020,Transportation Fuel Supplier,Transportation Fuel Supplier,424720,Petroleum and Petroleum Products Merchant Wholesalers (except Bulk Stations and Terminals),"World Fuel Services, Corp",NA,NA,NA,,,,,,,,,,Failed to Report.,,,
Western Petroleum Company,2017,Transportation Fuel Supplier,Transportation Fuel Supplier,424720,Petroleum and Petroleum Products Merchant Wholesalers (except Bulk Stations and Terminals),"World Fuel Services, Corp",NA,NA,NA,12906,239,12667,0,0,0,0,0,0,,,,
Tree Top - Selah Campus,2016,Food Production,Fruit Products,311411,"Frozen Fruit, Juice, and Vegetable Manufacturing",Tree Top Inc.,Selah,Yakima,Yakima Regional Clean Air Agency,18185,0,18166,9,10,0,0,0,0,,1,"(46.64992, -120.52755)",POINT (-120.52755000000002 46.64992)
Tree Top - Selah Campus,2013,Food Production,Fruit Products,311411,"Frozen Fruit, Juice, and Vegetable Manufacturing",Tree Top Inc.,Selah,Yakima,Yakima Regional Clean Air Agency,15638,0,15622,7,9,0,0,0,0,,1,"(46.64992, -120.52755)",POINT (-120.52755000000002 46.64992)
Shell Puget Sound Refinery - Anacortes,2015,Petroleum Systems,Petroleum Refineries,324110,Petroleum Refineries,Shell Petroleum Inc.,Anacortes,Skagit,Northwest Clean Air Agency,1946496,0,1935309,6802,4385,0,0,0,0,,4,"(48.470931, -122.559161)",POINT (-122.559161 48.470931)
